link,title,date,text,text_sum,client,client_score
https://tass.ru/ekonomika/18648301,"""МТС Энтертейнмент"" купила Ticketscloud",2023-09-04 12:00:00,"МОСКВА, 4 сентября.                         /              ТАСС       /.                            Дочерняя компания сотового оператора                                   МТС                         ""                                   МТС Энтертейнмент                         "" приобрела 85% долей билетного сервиса для организации мероприятий Ticketscloud.                     Об этом сообщает пресс-служба оператора.                  ""                           ПАО ""МТС""       объявляет о том, что ее дочерняя компания ""              МТС Энтертейнмент       "" подписала обязывающую документацию о приобретении 85% долей              ООО ""Тикетсклауд""       (платформа Ticketscloud), одного из лидирующих в России сервисов полного цикла для организаторов мероприятий"", - сказано в сообщении.                     Стоимость предстоящей сделки в сообщении не раскрывается.                   Как полагают в компании, сделка позволит укрепить позиции              МТС       на рынке продаж билетов, значительно увеличить долю рынка и продавать более 11 млн билетов на мероприятия ежегодно.          Согласно сообщению,              Ticketscloud       будет работать в качестве отдельного направления, подключая организаторов мероприятий к билетным витринам              МТС       и предлагая им маркетинговые возможности экосистемы.          Кроме того,              Ticketscloud       сохранит свою текущую команду и операционное управление, а также в проекте останутся и основатели компании -              Егор Егерев       и              Катерина Кириллова       .          ""Компании будут совместно развивать цифровые и мобильные продукты для концертных и театральных организаторов и выходить на новые рынки.          В ближайших планах - интеграция программ лояльности              МТС       в продукты и сервисы Ticketscloud.          Клиенты              МТС Live       получат возможность купить билеты практически на все мероприятия, которые проходят в России.          Вместе компании рассчитывают занять более 30% билетного рынка к концу 2023 года"", - добавили в              МТС       .                     ""                           МТС Энтертейнмент       "" - дочерняя компания, объединяющая проекты и активы              МТС       в сфере офлайн-развлечений, в которые входят: билетные сервисы              МТС Live       и              Ticketland       , приложение              МТС Live App       , направление по организации концертных и театральных выступлений, продюсирование мероприятий и федеральная сеть              МТС Live Холл       с площадками в Москве, Санкт-Петербурге, Челябинске, Воронеже и Екатеринбурге.                             Ticketscloud - персональный цифровой помощник для организации мероприятий.                        Выручка                    Ticketscloud            в 2022 году составила более 200 млн рублей.","Дочерняя компания сотового оператора                                   МТС                         ""                                   МТС Энтертейнмент                         "" приобрела 85% долей билетного сервиса для организации мероприятий Ticketscloud. ""                           ПАО ""МТС""       объявляет о том, что ее дочерняя компания ""              МТС Энтертейнмент       "" подписала обязывающую документацию о приобретении 85% долей              ООО ""Тикетсклауд""       (платформа Ticketscloud), одного из лидирующих в России сервисов полного цикла для организаторов мероприятий"", - сказано в сообщении. Как полагают в компании, сделка позволит укрепить позиции              МТС       на рынке продаж билетов, значительно увеличить долю рынка и продавать более 11 млн билетов на мероприятия ежегодно. Вместе компании рассчитывают занять более 30% билетного рынка к концу 2023 года"", - добавили в              МТС       . ""                           МТС Энтертейнмент       "" - дочерняя компания, объединяющая проекты и активы              МТС       в сфере офлайн-развлечений, в которые входят: билетные сервисы              МТС Live       и              Ticketland       , приложение              МТС Live App       , направление по организации концертных и театральных выступлений, продюсирование мероприятий и федеральная сеть              МТС Live Холл       с площадками в Москве, Санкт-Петербурге, Челябинске, Воронеже и Екатеринбурге.",мтс,
https://www.vedomosti.ru/business/news/2023/09/04/993262-dochka-mts-priobrela-ticketscloud,«Дочка» МТС купила сервис по покупке билетов Ticketscloud,2023-09-04 12:00:00,"Дочернее предприятие                           МТС                                             «                           МТС                                             Энтертейнмент», владеющее сервисами                 Ticketland                                  ,                 Ponominalu                                  и                 МТС Live                                  , приобрело сервис по покупке билетов Ticketscloud. Об этом в разговоре с                           РБК                                  сообщил                руководитель структуры                 МТС                         Михаил Минин                .                                                                                             Как отметил основатель сервиса                 Егор Егерев                                  , по итогам сделки у него и его партнера                 Карины Кирилловой                                  останется 15%                 Ticketscloud                                  , остальная доля перешла «                 МТС Энтертейнмент                                  ».                 Сумма сделки не уточняется.                                                                                                     О переговорах по покупке сервиса стало известно в марте этого года. Первым об этом                 сообщил                «                 Коммерсантъ                ». К тому моменту переговоры уже достигли финальной стадии.                 По информации издания, актив был оценен в 0,5-2 млрд руб.                                                                                               Минин                объяснил интерес к покупке сервиса тем, что он «пережил падение концертного рынка сначала на фоне пандемии, а потом на фоне специальной военной операции».                           Точную сумму сделки он не назвал, но подтвердил, что полный выкуп компании должен произойти в течение двух лет.                                                                                                              Билетный агрегатор                 Ticketscloud                                  был основан в 2014 г. Согласно данным                 ЕГРЮЛ                                  , до сих пор доли владения компанией распределены следующим образом:                 Егереву                                  принадлежат 15% компании, оставшиеся 85% – у зарегистрированной на Британских Виргинских островах                 Ticketscloud Ltd                                  .                           По итогам 2022 г. чистая прибыль составила 80 млн руб. против убытка в 8 млн руб. в 2021 г.","Дочернее предприятие                           МТС                                             «                           МТС                                             Энтертейнмент», владеющее сервисами                 Ticketland                                  ,                 Ponominalu                                  и                 МТС Live                                  , приобрело сервис по покупке билетов Ticketscloud. Об этом в разговоре с                           РБК                                  сообщил                руководитель структуры                 МТС                         Михаил Минин                . Как отметил основатель сервиса                 Егор Егерев                                  , по итогам сделки у него и его партнера                 Карины Кирилловой                                  останется 15%                 Ticketscloud                                  , остальная доля перешла «                 МТС Энтертейнмент                                  ». По информации издания, актив был оценен в 0,5-2 млрд руб.                                                                                               Минин                объяснил интерес к покупке сервиса тем, что он «пережил падение концертного рынка сначала на фоне пандемии, а потом на фоне специальной военной операции». Билетный агрегатор                 Ticketscloud                                  был основан в 2014 г. Согласно данным                 ЕГРЮЛ                                  , до сих пор доли владения компанией распределены следующим образом:                 Егереву                                  принадлежат 15% компании, оставшиеся 85% – у зарегистрированной на Британских Виргинских островах                 Ticketscloud Ltd                                  .",мтс,
https://1prime.ru/Stocks/20230904/841649916.html,Российский рынок акций чуть ускорил рост,2023-09-04 12:00:00,"МОСКВА, 4 сен —             ПРАЙМ            .          Российский рынок акций плавно ускоряет темы роста во второй половине торгов понедельника и повышается почти на 1% на позитивном внешнем фоне, слабом рубле и отложенном спросе, следует из данных           Московской биржи          и комментариев аналитиков.                                                 Индекс           Мосбиржи                      к 15.07 мск растет на 0,96%, до 3262,4 пункта — максимума с 21 февраля 2022 года; долларовый индекс           РТС                      — на 0,56%, до 1061,38 пункта.             Ноябрьский фьючерс на нефть марки Brent в это же время почти не меняется, понижаясь на символические 0,06%, до 88,51 доллара за баррель.                                                                                                                                                                                                                                           ""Российские фондовые индексы усилили подъем в понедельник, при этом индекс                         Мосбиржи         обновил максимум с февраля прошлого года.        Поддержку отечественным акциям оказывают в целом достаточно оптимистичные настроения на зарубежных фондовых площадках, в том числе после объявленных на прошлой неделе китайскими властями мер поддержки экономики.         Помимо этого, продолжил ослабление курс рубля"", — говорит                  Игорь Додонов         из ""                  Финама         "".                   Дополнительную поддержку росту сегодня оказывает отложенный спрос на бумаги, сформировавшийся в пятницу из-за опасений инвесторов реализации каких-либо рисков на выходных, добавляет                         Дмитрий Бабин         из компании ""                  БКС Мир инвестиций         "".                                                    ЛИДЕРЫ                      РОСТА         И                  ПАДЕНИЯ КОТИРОВОК                                                                                                                           В лидерах роста капитализации в отсутствие новостей оказываются низколиквидные акции                         Ашинского металлургического завода         (+14,48%), а также расписки ""                  Русагро         "" (13%).                          Также существенно дорожают расписки                                 VK               (+3,89%), акции ""                         Соллерса               "" (+6,86%), ""                         Русала               "" (+3,41%) и ""                         Русснефти               "" (+4,71%).                        ""Глава ""                         Русснефти         ""                  Евгений Толочек         ранее в сентябре сообщил, что компания продолжает вести высокоэффективное бурение, а после периода жесткой экономии в начале года прогнозы на вторую половину текущего года оптимистичные в связи с нормализацией дисконта между марками Brent и Urals"", — напомнила                  Елена Кожухова         из компании ""                  Велес капитал         "".                                                                                                                               А бумаги                         VK         дорожают на благодаря объявлению о выходе из бета-версии и официальном запуске видеоплатформы ""                  VK Видео         "", которая должна увеличить доходы компании от рекламы — таково мнение                  Владимира Чернова         из                  Freedom Finance Global         .                                                    Снижение котировок демонстрируют расписки ""                                 Циана               "" (-0,65%), акции ""                         Юнипро               "" (-0,27%), расписки                         Noventiq               (-0,26%) и ""                         Эталона               "" (-0,19%).                               ПРОГНОЗЫ                                                                                                                                  ""Учитывая довольно спокойный ход торгов в мире на фоне биржевого выходного в США, российские акции имеют все шансы завершить в неплохом плюсе сегодняшние торги.             Хотя нельзя исключать некоторой фиксации прибыли ближе к концу сессии"", — полагает         Додонов        .               По мнению                         Чернова         , торги понедельника индекс                  Мосбиржи         закроет в рамках диапазона 3200-3290 пунктов,                  РТС         — 1035-1075 пунктов.                   Что касается более длинного горизонта, то, как считает                         Александр Фетисов         из                  Россельхозбанка         , в течение сентября индекс                  Мосбиржи         может преодолеть отметку в 3300 пунктов.","Российский рынок акций плавно ускоряет темы роста во второй половине торгов понедельника и повышается почти на 1% на позитивном внешнем фоне, слабом рубле и отложенном спросе, следует из данных           Московской биржи          и комментариев аналитиков. Индекс           Мосбиржи                      к 15.07 мск растет на 0,96%, до 3262,4 пункта — максимума с 21 февраля 2022 года; долларовый индекс           РТС                      — на 0,56%, до 1061,38 пункта. ""Российские фондовые индексы усилили подъем в понедельник, при этом индекс                         Мосбиржи         обновил максимум с февраля прошлого года. ЛИДЕРЫ                      РОСТА         И                  ПАДЕНИЯ КОТИРОВОК                                                                                                                           В лидерах роста капитализации в отсутствие новостей оказываются низколиквидные акции                         Ашинского металлургического завода         (+14,48%), а также расписки ""                  Русагро         "" (13%). По мнению                         Чернова         , торги понедельника индекс                  Мосбиржи         закроет в рамках диапазона 3200-3290 пунктов,                  РТС         — 1035-1075 пунктов.",русагро,
